{
  "schema_version": "account_incidents_panel.v1",
  "workbench": "Account Workbench",
  "panel": "Account Incidents Panel",
  "route": "/accounts/{account_id}/incidents",
  "fixture_state": "active_incidents",
  "context": {
    "trading_day": "2026-06-14",
    "session_id": "account-workbench.fixture.20260614.006",
    "run_id": "account-incidents.fixture.active.001",
    "reducer_checkpoint_id": "account-incidents.checkpoint.active.001",
    "reducer_checkpoint_ts": "2026-06-14T15:34:16Z",
    "stream_state": "healthy",
    "projection_owner": "account-console-contracts",
    "source_authority": "deterministic_fixture"
  },
  "account": {
    "account_id": "acct.demo-19053",
    "account_alias": "19053",
    "account_kind": "real_feed_sandbox_paper"
  },
  "incidents": [
    {
      "incident_id": "incident.stale-order.001",
      "category": "stale_order",
      "severity": "warning",
      "status": "open",
      "owner": "external order lifecycle owner",
      "next_action": "refresh lifecycle owner artifact before operator closeout",
      "repair_ref": "fixture://account-workbench/incidents/acct.demo-19053/stale-order/repair-001",
      "source_ref": "fixture://account-workbench/incidents/acct.demo-19053/active/stale-order",
      "checksum": "sha256:c4c4c4c4c4c4c4c4c4c4c4c4c4c4c4c4c4c4c4c4c4c4c4c4c4c4c4c4c4c4c4c4"
    }
  ],
  "blockers": [],
  "source_refs": [
    {
      "kind": "incident_projection",
      "owner": "account-console-contracts",
      "source_ref": "fixture://account-workbench/incidents/acct.demo-19053/active",
      "checksum": "sha256:c5c5c5c5c5c5c5c5c5c5c5c5c5c5c5c5c5c5c5c5c5c5c5c5c5c5c5c5c5c5c5c5",
      "authority": "deterministic incident fixture; not runtime authority"
    }
  ],
  "boundaries": {
    "read_only_projection": true,
    "runtime_truth": false,
    "account_truth": false,
    "order_truth": false,
    "ledger_truth": false,
    "ui_truth": false,
    "paper_ready": false,
    "live_ready": false,
    "broker_tradable": false,
    "admission_truth": false,
    "capital_truth": false,
    "action_controls": false
  },
  "rejection_rules": [
    "Reject incident display as repair action authority.",
    "Reject incident absence as proof that no runtime incident exists."
  ]
}
